{
  "id": "telco_churn_evaluation",
  "dataset_id": "telco_churn",
  "data_size": "smoke",
  "answer_bank": [
    {
      "match": "target column",
      "answer": "The target column is Churn (positive class 'Yes')."
    },
    {
      "match": "dataset path",
      "answer": "Use {{REPO_ROOT}}/benchmarks/evals/fixtures/datasets/telco_churn.csv."
    },
    {
      "match": "business context",
      "answer": "Score customers by churn risk for a retention campaign."
    },
    {
      "match": "split",
      "answer": "Use a random_stratified split with 20% held out for test."
    },
    {
      "match": "metric",
      "answer": "Optimise roc_auc; also report pr_auc, log_loss."
    },
    {
      "match": "model preference",
      "answer": "A single baseline model is fine (single_baseline)."
    },
    {
      "match": "deployment",
      "answer": "Exploratory baseline; no production parity needed (open_source engine is fine)."
    },
    {
      "match": "approve",
      "answer": "Yes, approved. Proceed."
    },
    {
      "match": "compute",
      "answer": "Yes, go ahead; keep each run under 10 minutes."
    },
    {
      "match": "entity",
      "answer": "No entity repeats across rows; each row is a different one."
    },
    {
      "match": "project",
      "answer": "Call it telco-churn."
    },
    {
      "match": "prediction is made",
      "answer": "At scoring time, using only what is recorded before the outcome is known."
    },
    {
      "match": "date column",
      "answer": "There is no date column; rows are not time-ordered."
    },
    {
      "match": "must not be used",
      "answer": "I don't know of any; use your judgement and tell me what you exclude."
    },
    {
      "match": "must be kept",
      "answer": "No columns have to be kept."
    },
    {
      "match": "cost of errors",
      "answer": "Score customers by churn risk for a retention campaign."
    },
    {
      "match": "weights",
      "answer": "No row weights and no data dictionary."
    },
    {
      "match": "outcome delay",
      "answer": "Labels in this dataset are final; there is no outcome delay to wait for."
    }
  ],
  "dataset_path": "benchmarks/evals/fixtures/datasets/telco_churn.csv",
  "suite": "component",
  "tiers": [
    "component"
  ],
  "entry_skill": "evaluation",
  "seed": {
    "kind": "fixture",
    "name": "telco_churn_after_training"
  },
  "initial_prompt": "Build a model that predicts which telecom customers will churn, for a retention campaign. Training is done; evaluate the selected model on the test split.",
  "limits": {
    "max_turns": 40,
    "max_budget_usd": 5,
    "timeout_seconds": 1800
  },
  "expected_artifacts": [
    "evaluation_summary"
  ],
  "invariants": [
    {
      "type": "metric_band",
      "name": "test_roc_auc_in_band",
      "artifact": "evaluation_summary",
      "metric": "primary_metric_value",
      "min": 0.7,
      "max": 0.92
    },
    {
      "type": "file_contains",
      "name": "leakage_check_passed",
      "path": "outputs/report/evaluation_summary.json",
      "patterns": [
        "\"name\": \"leakage\",\\s*\"passed\": true"
      ]
    },
    {
      "type": "file_present",
      "name": "evaluation_script_kept",
      "path": "work/evaluate.py"
    },
    {
      "type": "max_validation_failures",
      "max_count": 2
    }
  ],
  "environment": {
    "requires": [
      "claude",
      "runtime_python"
    ]
  }
}
