{
  "id": "synthetic_fraud_end_to_end",
  "dataset_id": "synthetic_fraud",
  "data_size": "smoke",
  "answer_bank": [
    {
      "match": "target column",
      "answer": "The target column is is_fraud (positive class 1)."
    },
    {
      "match": "dataset path",
      "answer": "Use {{REPO_ROOT}}/benchmarks/evals/fixtures/datasets/synthetic_fraud.csv."
    },
    {
      "match": "business context",
      "answer": "Rank card transactions so analysts review the riskiest 1% first."
    },
    {
      "match": "split",
      "answer": "Use a temporal on event_time split with 20% held out for test."
    },
    {
      "match": "metric",
      "answer": "Optimise pr_auc; also report roc_auc, precision_at_top_1pct, recall_at_top_1pct."
    },
    {
      "match": "model preference",
      "answer": "A single baseline model is fine (single_baseline)."
    },
    {
      "match": "deployment",
      "answer": "Exploratory baseline; no production parity needed (open_source engine is fine)."
    },
    {
      "match": "approve",
      "answer": "Yes, approved. Proceed."
    },
    {
      "match": "compute",
      "answer": "Yes, go ahead; keep each run under 10 minutes."
    },
    {
      "match": "entity",
      "answer": "customer_id identifies the entity; rows repeat per entity."
    },
    {
      "match": "project",
      "answer": "Call it synthetic-fraud."
    },
    {
      "match": "prediction is made",
      "answer": "At scoring time, using only what is recorded before the outcome is known."
    },
    {
      "match": "date column",
      "answer": "event_time timestamps each row; test should be the latest period."
    },
    {
      "match": "must not be used",
      "answer": "I don't know of any; use your judgement and tell me what you exclude."
    },
    {
      "match": "must be kept",
      "answer": "No columns have to be kept."
    },
    {
      "match": "cost of errors",
      "answer": "Rank card transactions so analysts review the riskiest 1% first."
    },
    {
      "match": "weights",
      "answer": "No row weights and no data dictionary."
    },
    {
      "match": "outcome delay",
      "answer": "Labels in this dataset are final; there is no outcome delay to wait for."
    },
    {
      "match": "vintage",
      "answer": "Analyse the vintages and propose a selection; keep all periods unless the evidence says otherwise, and tell me what you exclude."
    }
  ],
  "dataset_path": "benchmarks/evals/fixtures/datasets/synthetic_fraud.csv",
  "suite": "e2e",
  "tiers": [
    "pipeline",
    "e2e",
    "real"
  ],
  "entry_skill": "prediction-contract",
  "seed": {
    "kind": "empty"
  },
  "initial_prompt": "Build a model that flags likely fraudulent card transactions for analyst review.",
  "limits": {
    "max_turns": 150,
    "max_budget_usd": 20,
    "timeout_seconds": 5400
  },
  "expected_artifacts": [
    "prediction_contract",
    "dataset_profile",
    "column_profile",
    "workflow_plan",
    "preprocessing_summary",
    "training_summary",
    "evaluation_summary"
  ],
  "invariants": [
    {
      "type": "metric_band",
      "name": "test_pr_auc_in_band",
      "artifact": "evaluation_summary",
      "metric": "primary_metric_value",
      "min": 0.25,
      "max": 0.85
    },
    {
      "type": "file_contains",
      "name": "leakage_check_passed",
      "path": "outputs/report/evaluation_summary.json",
      "patterns": [
        "\"name\": \"leakage\",\\s*\"passed\": true"
      ]
    },
    {
      "type": "file_contains",
      "name": "chargeback_flag_dropped",
      "path": "state/workflow_plan.json",
      "patterns": [
        "\"chargeback_flag\""
      ]
    },
    {
      "type": "file_contains",
      "name": "chargeback_flag_caught_as_leakage",
      "path": "column_profile.json",
      "patterns": [
        "\"name\": \"chargeback_flag\",[^}]*\"role\": \"(leakage_suspect|drop)\""
      ]
    },
    {
      "type": "file_contains",
      "name": "currency_is_drop",
      "path": "column_profile.json",
      "patterns": [
        "\"name\": \"currency\",[^}]*\"role\": \"drop\""
      ]
    },
    {
      "type": "file_contains",
      "name": "transaction_id_is_id",
      "path": "column_profile.json",
      "patterns": [
        "\"name\": \"transaction_id\",[^}]*\"role\": \"id\""
      ]
    },
    {
      "type": "file_present",
      "name": "feature_selection_ran",
      "path": "outputs/model/feature_selection.json"
    },
    {
      "type": "max_validation_failures",
      "max_count": 4
    }
  ],
  "environment": {
    "requires": [
      "claude",
      "runtime_python"
    ]
  }
}
