{
  "id": "synthetic_fraud_seed_evaluated",
  "dataset_id": "synthetic_fraud",
  "data_size": "smoke",
  "answer_bank": [
    {
      "match": "target column",
      "answer": "The target column is is_fraud (positive class 1)."
    },
    {
      "match": "dataset path",
      "answer": "Use {{REPO_ROOT}}/benchmarks/evals/fixtures/datasets/synthetic_fraud.csv."
    },
    {
      "match": "business context",
      "answer": "Rank card transactions so analysts review the riskiest 1% first."
    },
    {
      "match": "split",
      "answer": "Use a temporal on event_time split with 20% held out for test."
    },
    {
      "match": "metric",
      "answer": "Optimise pr_auc; also report roc_auc, precision_at_top_1pct, recall_at_top_1pct."
    },
    {
      "match": "model preference",
      "answer": "A single baseline model is fine (single_baseline)."
    },
    {
      "match": "deployment",
      "answer": "Exploratory baseline; no production parity needed (open_source engine is fine)."
    },
    {
      "match": "approve",
      "answer": "Yes, approved. Proceed."
    },
    {
      "match": "compute",
      "answer": "Yes, go ahead; keep each run under 10 minutes."
    },
    {
      "match": "entity",
      "answer": "customer_id identifies the entity; rows repeat per entity."
    }
  ],
  "dataset_path": "benchmarks/evals/fixtures/datasets/synthetic_fraud.csv",
  "suite": "seeds",
  "tiers": [
    "deterministic"
  ],
  "entry_skill": "evaluation",
  "seed": {
    "kind": "fixture",
    "name": "synthetic_fraud_evaluated"
  },
  "initial_prompt": "Deterministic check of the committed evaluated seed (no agent run).",
  "limits": {
    "max_turns": 1,
    "max_budget_usd": 0,
    "timeout_seconds": 60
  },
  "expected_artifacts": [
    "prediction_contract",
    "dataset_profile",
    "column_profile",
    "workflow_plan",
    "preprocessing_summary",
    "training_summary",
    "evaluation_summary"
  ],
  "invariants": [
    {
      "type": "metric_band",
      "name": "test_pr_auc_in_band",
      "artifact": "evaluation_summary",
      "metric": "primary_metric_value",
      "min": 0.25,
      "max": 0.85
    },
    {
      "type": "file_contains",
      "name": "leakage_check_passed",
      "path": "outputs/report/evaluation_summary.json",
      "patterns": [
        "\"name\": \"leakage\",\\s*\"passed\": true"
      ]
    },
    {
      "type": "file_contains",
      "name": "chargeback_flag_dropped",
      "path": "state/workflow_plan.json",
      "patterns": [
        "\"chargeback_flag\""
      ]
    },
    {
      "type": "file_contains",
      "name": "chargeback_flag_is_leakage_suspect",
      "path": "column_profile.json",
      "patterns": [
        "\"name\": \"chargeback_flag\",[^}]*\"role\": \"leakage_suspect\""
      ]
    },
    {
      "type": "file_contains",
      "name": "currency_is_drop",
      "path": "column_profile.json",
      "patterns": [
        "\"name\": \"currency\",[^}]*\"role\": \"drop\""
      ]
    },
    {
      "type": "file_contains",
      "name": "transaction_id_is_id",
      "path": "column_profile.json",
      "patterns": [
        "\"name\": \"transaction_id\",[^}]*\"role\": \"id\""
      ]
    },
    {
      "type": "max_validation_failures",
      "max_count": 0
    }
  ],
  "environment": {
    "requires": []
  }
}
